no,petition_id,title,url,Category1,Category2,Category3,Category4,Category5
723,7469879,Justin Trudeau: Eliminate Torturing Murdering Ransom Hunters of Citizens Abroad,https://api.change.org/p/justin-trudeau-eliminate-torturing-murdering-ransom-hunters-of-citizens-abroad,Global,Human Rights,,,
724,9043595,"Paul Ryan: 

Support a Tax on the Consumption of Palm Oil Products",https://api.change.org/p/paul-ryan-support-a-tax-on-the-consumption-of-palm-oil-products,Palm Oil,National,Political,Taxes,
725,8359178,cliff.barber@nelincs.gov.uk: Maintain Weekly Recycling Collections in N E Lincs,https://api.change.org/p/cliff-barber-nelincs-gov-uk-maintain-weekly-recycling-collections-in-n-e-lincs,Global,Waste,Recycle,Plastic,
726,6794534,Mack Clapp Chairman of the investment committee for the University of Montana Foundation: Support climate justice: Divest the University of Montana from Fossil Fuels,https://api.change.org/p/mack-clapp-chairman-of-the-investment-committee-for-the-university-of-montana-foundation-support-climate-justice-divest-the-university-of-montana-from-fossil-fuels,National,Education,,,
727,9950822,Cambridge City Council: Reject the Proposed Development at 3 and 5 Queen Edith's Way,https://api.change.org/p/cambridge-city-council-reject-the-proposed-development-at-3-and-5-queen-edith-s-way,Global,Landscapes and forests,,,
728,7293851,Morguard : Keep Northshore Square Mall an INDOOR MALL,https://api.change.org/p/morguard-keep-northshore-square-mall-an-indoor-mall,National,Health and Safety,,,
729,8604692,Dakota Access Pipeline: Solidarity for Indigenous People at Standing Rock,https://api.change.org/p/dakota-access-pipeline-solidarity-for-indigenous-people-at-standing-rock,Clean energy,Human Rights,,,
730,5590338,sthildasdivestment@outlook.com: St Hilda's College: DIVEST from companies involved in the fossil fuel industry,https://api.change.org/p/sthildasdivestment-outlook-com-st-hilda-s-college-divest-from-companies-involved-in-the-fossil-fuel-industry,Global,Education,,,
731,6862883,Barack Obama: Change 2016 to 2017 Before It Kills Again,https://api.change.org/p/barack-obama-change-2016-to-2017-before-it-kills-again,National,Political,,,
732,9078074,New York City Public Schools: Are school wasting? Join the food waste conversation today!,https://api.change.org/p/new-york-city-public-schools-are-school-wasting-join-the-food-waste-conversation-today,National,Education,Waste,,
733,9001547,All 50 State Legislatures: Give the people the right to elect the President of the United States,https://api.change.org/p/all-50-state-legislatures-give-the-people-the-right-to-elect-the-president-of-the-united-states,National,Political,US Elections,,
734,6257318,Donald Trump: PSU should build a superdome over the campus to keep out the fucking shitty weather,https://api.change.org/p/donald-trump-psu-should-build-a-superdome-over-the-campus-to-keep-out-the-fucking-shitty-weather,National,Human Rights,Weather,,
735,8749037,An Open Letter to the Electors of the United States Electoral College - Vote on 12/19/16,https://api.change.org/p/an-open-letter-to-the-electors-of-the-united-states-electoral-college-vote-on-12-19-16,National,Political,US Elections,,
736,8886986,Legislators in all non-US nations: Impose carbon tax on US imports if Trump withdraws from the Paris Climate Accord,https://api.change.org/p/legislators-in-all-non-us-nations-impose-carbon-tax-on-us-imports-if-trump-withdraws-from-the-paris-climate-accord,National,Political,Paris Agreement,,
737,3921544,Preserve More Wildlands in NH,https://api.change.org/p/preserve-more-wildlands-in-nh,National,Landscapes and forests,Wildlife,,
738,6840836,Support STOP FOOD WASTE IN THE USA,https://api.change.org/p/support-stop-food-waste-in-the-usa,National,Waste,Food,,
739,8942675,United States Senate: Block Myron Ebell as head of EPA,https://api.change.org/p/united-states-senate-block-myron-ebell-as-head-of-epa,National,Political,,,
740,9086921,"Energy Transfer Partners: #NoDAPL: ETP, Stop Using Police to Defend Private Profit",https://api.change.org/p/energy-transfer-partners-nodapl-etp-stop-using-police-to-defend-private-profit,Clean energy,Business Greed,,,
741,8479340,Justin Trudeau: Make Jim Carr Change His Name to Jim Bicycle,https://api.change.org/p/justin-trudeau-make-jim-carr-change-his-name-to-jim-bicycle,Global,Clean energy,,,
742,8872841,Donald Trump: Don’t Let the Light Go Out on Democracy in the USA,https://api.change.org/p/donald-trump-don-t-let-the-light-go-out-on-democracy-in-the-usa,National,Political,,,
743,5762294,"Staunton City Schools Board, Linda G. Reviea, Ed.D. Division Superintendent: Urge Staunton City Schools to take a small and simple step to Go Solar:",https://api.change.org/p/staunton-city-schools-board-linda-g-reviea-ed-d-division-superintendent-urge-staunton-city-schools-to-take-a-small-and-simple-step-to-go-solar,National,Education,Clean energy,,
744,70098,Ratify UN Optional Protocol on the Elimination of All Forms of Discrimination Against Women (CEDAW),https://api.change.org/p/ratify-un-optional-protocol-on-the-elimination-of-all-forms-of-discrimination-against-women-cedaw,Global,Human Rights,,,
745,7262639,Paul Heroux: Shut down all natural gas power plants in Massachusettes,https://api.change.org/p/paul-heroux-shut-down-all-natural-gas-power-plants-in-massachusettes,National,Clean energy,,,
746,7387235,Stop Global Warming,https://api.change.org/p/stop-global-warming-6aba49bc-522d-4331-91f4-a9bc6ab01e63,Global,Clean energy,Sustainability,,
747,8828477,"The Prime Minister of India: Black Money recovered from the great Demonetisation move should be spent on SDGs, and . .",https://api.change.org/p/the-prime-minister-of-india-black-money-recovered-from-the-great-demonetisation-move-should-be-spent-on-sdgs-and,Global,Sustainability,,,
748,6757682,President David Boren: OU Green Week 2016,https://api.change.org/p/president-david-boren-ou-green-week-2016,National,Education,Waste,Clean energy,
749,7376867,British Government: The British Government must restate its committment to the Paris climate deal post-Brexit,https://api.change.org/p/british-government-the-british-government-must-restate-its-committment-to-the-paris-climate-deal-post-brexit,Global,Sustainability,Paris Agreement,,
750,4605932,Justin Trudeau: Build a 21st century Prime Minister's residence,https://api.change.org/p/justin-trudeau-build-a-21st-century-prime-minister-s-residence,Global,Heritage,,,
751,6794945,Ministory of Environment Forest and Climate Change: Tackling drought and deforestation,https://api.change.org/p/ministory-of-environment-forest-and-climate-change-tackling-drought-and-deforestation,Global,Landscapes and forests,,,
752,10046471,coral.org:  death of the coral reef,https://api.change.org/p/coral-org-death-of-the-coral-reef,Global,Wildlife,,,
753,8729417,America: Impeach Donald Trump,https://api.change.org/p/america-impeach-donald-trump-32715297-c815-404c-9d30-108708a0ab53,National,Political,,,
754,7076609,"Bernie Sanders: Bernie, Hillary:  The FIGHTING has got to stop!",https://api.change.org/p/bernie-sanders-bernie-hillary-the-fighting-has-got-to-stop,National,Political,US Elections,,
755,7415162,"The first thing you & I require is ""fresh air.""  We appeal to the citizens of Visakhapatnam to lend their support to this public campaign against pollution - our leaders to recognize the seriousness of the pollution problem for the people and act firmly.",https://api.change.org/p/the-first-thing-you-i-require-is-fresh-air-we-appeal-to-the-citizens-of-visakhapatnam-to-lend-their-support-to-this-public-campaign-against-pollution-our-leaders-to-recognize-the-seriousness-of-the-pollution-problem-for-the-people-and-act-firmly,Global,Pollution,,,
756,6292766,Michael Bloomberg: Please Mr. Bloomberg Run for President,https://api.change.org/p/michael-bloomberg-please-mr-bloomberg-run-for-president,National,Political,US Elections,,
757,7812773,No To Proposed Minglanilla Reclamation Project,https://api.change.org/p/no-to-proposed-minglanilla-reclamation-project,Global,Wildlife,,,
758,5821310,Eco-Destructive Ways: REDUCE FOR RED PANDAS,https://api.change.org/p/eco-destructive-ways-reduce-for-red-pandas,National,Animal Rights,,,
759,7389020,Let us have a less divisive European relationship in the future - choose EFTA membership,https://api.change.org/p/let-us-have-a-less-divisive-european-relationship-in-the-future-choose-efta-membership,Global,Human Rights,,,
760,7052759,SIGN OUR PETITION in support of creating a new independent third party in America.,https://api.change.org/p/sign-our-petition-in-support-of-creating-a-new-independent-third-party-in-america,National,Political,US Elections,,
761,8373647,NSW : NSW Government: Support sustainable food waste management,https://api.change.org/p/nsw-nsw-government-support-sustainable-food-waste-management,Global,Waste,Food,,
762,8852015,"President of the Philippines : URGE HIS EXCELLENCY PRESIDENT RODRIGO DUTERTE TO CREATE A ZERO HUNGER COMMISSION. 
JOIN US AND SIGN THE PETITION NOW!",https://api.change.org/p/president-of-the-philippines-urge-his-excellency-president-rodrigo-duterte-to-create-a-zero-hunger-commission-join-us-and-sign-the-petition-now,Global,Food,Human Rights,,
763,8281853,"The Ministry of Environment, Forest and Climate Change: Reduce Air Pollution in Delhi",https://api.change.org/p/the-ministry-of-environment-forest-and-climate-change-reduce-air-pollution-in-delhi,Global,Pollution,,,
764,20947,N Coast Earth First,https://api.change.org/p/n-coast-earth-first,Business greed,Human Rights,National,,
765,7420676,Minnesota State Senate: Make Minnesota a Right to Dry State,https://api.change.org/p/minnesota-state-senate-make-minnesota-a-right-to-dry-state,National,Health and Safety,Human Rights,,
766,8815535,"Narendra Modi: Make new currency notes from recyclable plastic, making them more durable and disposable.",https://api.change.org/p/narendra-modi-make-new-currency-notes-from-recyclable-plastic-making-them-more-durable-and-disposable,Global,Recycle,Plastic,,
767,5857994,"Malcolm Turnbull MP, Christopher Pyne, Michael Borgas, Mark Dreyfus: CSIRO AUSTRALIA - A restructure has been approved and we could loose vital alot more..",https://api.change.org/p/malcolm-turnbull-mp-christopher-pyne-michael-borgas-mark-dreyfus-csiro-australia-a-restructure-has-been-approved-and-we-could-loose-vital-alot-more,Global,Education,,,
768,8641013,CNN: Get the Baldwin Brothers on CNN,https://api.change.org/p/cnn-get-the-baldwin-brothers-on-cnn,National,Political,,,
769,8920685,Mayor : We support Bloomfield putting solar panels on public buildings,https://api.change.org/p/mayor-we-support-bloomfield-putting-solar-panels-on-public-buildings,National,Clean energy,,,
770,7522586,UK Parliament: Introduce proportional representation into Parliament.,https://api.change.org/p/uk-parliament-introduce-proportional-representation-into-parliament,Global,Political,,,
771,5825554,Norwegian Nobel Committee: Norwegian Nobel Committee - Revoke Donald Trump's nomination,https://api.change.org/p/norwegian-nobel-committee-norwegian-nobel-committee-revoke-donald-trump-s-nomination,National,Political,,,
772,6311462,CT Gen'l Assembly Public Safety Committee: Let police check permits of gun owners carrying in public,https://api.change.org/p/ct-gen-l-assembly-public-safety-committee-let-police-check-permits-of-gun-owners-carrying-in-public,National,Health and Safety,,,
773,6923441,City of Los : Replace Metro ExpressLanes (FasTrak) with HOV lanes in LA,https://api.change.org/p/city-of-los-replace-metro-expresslanes-fastrak-with-hov-lanes-in-la,National,Human Rights,,,
774,6064426,fb82011@gmail.com: Sign the petition for Araluen and Neringla to become part of Eurobodalla Council,https://api.change.org/p/fb82011-gmail-com-sign-the-petition-for-araluen-and-neringla-to-become-part-of-eurobodalla-council,Global,Health and Safety,Urban Planning,,
775,9679970,Young New Democrats to PM: fire the youth minister // Les jeunes néo-démocrates demandent au Premier ministre de renvoyer son ministre de la jeunesse,https://api.change.org/p/young-new-democrats-to-pm-fire-the-youth-minister-les-jeunes-n%C3%A9o-d%C3%A9mocrates-demandent-au-premier-ministre-de-renvoyer-son-ministre-de-la-jeunesse,Global,Political,,,
776,7084223,A petition for an on-line interactive map of all old-growth forest in B.C. and Alberta.,https://api.change.org/p/a-petition-for-an-on-line-interactive-map-of-all-old-growth-forest-in-b-c-and-alberta,Global,Landscapes and forests,,,
777,6453647,INDIAN PARLIAMENT: AN OPEN  LETTER FROM COMMON MAN TO RAJYA SABHA MPs,https://api.change.org/p/indian-parliament-an-open-letter-from-common-man-to-rajya-sabha-mps,Global,Political,Waste,,
778,8486747,Implore Chris Wallace to demand - No vicious talk! Just issues talk!,https://api.change.org/p/implore-chris-wallace-to-demand-no-vicious-talk-just-issues-talk,National,Political,US Elections,,
779,7004009,City of Vincent: City of Vincent - divest our rates from fossil fuels,https://api.change.org/p/city-of-vincent-city-of-vincent-divest-our-rates-from-fossil-fuels,Global,Clean energy,,,
780,8090879,Palo Alto City Council: Mandate best practices for underground construction,https://api.change.org/p/palo-alto-city-council-mandate-best-practices-for-underground-construction,National,Water,Sustainability,,
781,6848165,ldlanigan@csbsju.edu: Locally Grown Food to be served at the College of Saint Benedict,https://api.change.org/p/ldlanigan-csbsju-edu-locally-grown-food-to-be-served-at-the-college-of-saint-benedict,National,Food,Health and Safety,Education,
782,8624312,"Ministry of Environment, Forest and Climate Change. Indira Paryavaran ... New Delhi - 110 003. INDI: Ban crackers & burning of garbage",https://api.change.org/p/ministry-of-environment-forest-and-climate-change-indira-paryavaran-new-delhi-110-003-indi-ban-crackers-burning-of-garbage,Global,Waste,Fire,Recycle,
783,6955205,Hillary Clinton presidential campaign: Hillary Clinton to debate Bernie Sanders in California before the June 7th Primary,https://api.change.org/p/hillary-clinton-presidential-campaign-hillary-clinton-to-debate-bernie-sanders-in-california-before-the-june-7th-primary,National,Political,US Elections,,
784,8733545,Petition the Australian Government to Fund a Tesla Gigafactory,https://api.change.org/p/petition-the-australian-government-to-fund-a-tesla-gigafactory,Global,Clean energy,Sustainability,,
785,6786956,"The people of India: Help tackle India's pressing problems - Water Crisis, Heat-wave, Drought and Pollution.",https://api.change.org/p/the-people-of-india-help-tackle-india-s-pressing-problems-water-crisis-heat-wave-drought-and-pollution,Global,Water,Weather,,
786,6303128,Lorne Michaels: Canadian Prime Minister Justin Trudeau to host Saturday Night Live!,https://api.change.org/p/lorne-michaels-canadian-prime-minister-justin-trudeau-to-host-saturday-night-live,Global,Entertainment,US Elections,,
787,66778,"Global Sustainable Food and Resources  Cultivation, Production and Distribution",https://api.change.org/p/global-sustainable-food-and-resources-cultivation-production-and-distribution,Global,Food,Sustainability,Human Rights,
788,6647867,Repair Dorm Thermostats,https://api.change.org/p/repair-dorm-thermostats,National,Education,Weather,,
789,8781302,Donald Trump : Stop Trump from Hurting the Earth,https://api.change.org/p/donald-trump-stop-trump-from-hurting-the-earth,National,Political,,,
790,6545453,Bernie Sanders: Ask Sen Bernie Sanders to meet and speak with Dr Jill Stein of the Green Party,https://api.change.org/p/bernie-sanders-ask-sen-bernie-sanders-to-meet-and-speak-with-dr-jill-stein-of-the-green-party,National,Political,US Elections,,
791,7135511,Ann Kirkpatrick: Open Glen Canyon Dam; Unplug the Colorado River,https://api.change.org/p/ann-kirkpatrick-open-glen-canyon-dam-unplug-the-colorado-river,National,Water,,,
792,8822522,U.S. House of Representatives: Cut Federal Funding for Public Universities That Refuse to Remain Politically Neutral,https://api.change.org/p/u-s-house-of-representatives-cut-federal-funding-for-public-universities-that-refuse-to-remain-politically-neutral,National,Education,Human Rights,,
793,6775967,Gregory L Fenves: Get UT austin skateboard/longboard racks.,https://api.change.org/p/gregory-l-fenves-get-ut-austin-skateboard-longboard-racks,National,Transportation,Clean energy,,
794,6657722,Barbara Pompili: Against the systematic destruction of watermills in France,https://api.change.org/p/barbara-pompili-against-the-systematic-destruction-of-watermills-in-france,Global,Clean energy,,,
795,8194685,Erik Pederson: Let's reduce factory emissions in Califonia,https://api.change.org/p/erik-pederson-let-s-reduce-factory-emissions-in-califonia,National,Clean energy,Pollution,,
796,5667418,End the Gender-Biased Ban on Topless Women in Civic Center Plaza #FreeTheNipple #StandWithPP,https://api.change.org/p/end-the-gender-biased-ban-on-topless-women-in-civic-center-plaza-freethenipple-standwithpp,National,Education,,,
797,7429841,"Shona Dunn - Director General, Education Standards: Make Basic Politics Mandatory in Secondary Education.",https://api.change.org/p/shona-dunn-director-general-education-standards-make-basic-politics-mandatory-in-secondary-education,Global,Education,,,
798,8400071,"Hawkesbury City Council: Upgrade the playground facilities at the park on William Street, North Richmond, NSW.",https://api.change.org/p/hawkesbury-city-council-upgrade-the-playground-facilities-at-the-park-on-william-street-north-richmond-nsw,Global,Landscapes and forests,,,
799,6734486,Eric Lee Mar: Help get rid of ExxonMobil's presence in SF,https://api.change.org/p/eric-lee-mar-help-get-rid-of-exxonmobil-s-presence-in-sf,National,health and Safety,Clean energy,,
800,7954334,"Andrea Leadsom, Secretary of State for Environment, Food and Rural Affairs: Make Non-Recyclable Packaging Illegal by 2020",https://api.change.org/p/andrea-leadsom-secretary-of-state-for-environment-food-and-rural-affairs-make-non-recyclable-packaging-illegal-by-2020,Global,Recycle,Plastic,,
801,6909227,salamat@un.org: Help us get the UN to recognize the 19th of April as World Bicycle Day!,https://api.change.org/p/salamat-un-org-help-us-get-the-un-to-recognize-the-19th-of-april-as-world-bicycle-day,Global,Clean energy,,,
802,6382568,President of the United States: Overturn Citizens United - Democracy Cannot Be For Sale,https://api.change.org/p/president-of-the-united-states-overturn-citizens-united-democracy-cannot-be-for-sale,National,Political,Human Rights,,
803,9728351,Bill de Blasio: Seize Trump Tower Through Eminent Domain,https://api.change.org/p/bill-de-blasio-seize-trump-tower-through-eminent-domain,National,Political,Human Rights,Taxes,
804,5690638,Prime minister: Reduce Australia's carbon emissions and support a renewable energy market.,https://api.change.org/p/prime-minister-reduce-australia-s-carbon-emissions-and-support-a-renewable-energy-market,Global,Clean energy,Sustainability,,
805,6889484,"Tower Hamlets Mayor: Tower Hamlets Mayor, help future generations by dealing with corruption on your doorstep",https://api.change.org/p/tower-hamlets-mayor-tower-hamlets-mayor-help-future-generations-by-dealing-with-corruption-on-your-doorstep,Global,Human Rights,,,
806,8624423,Ministry of Environment  Forests & Climate Change: Ban bursting firecrackers after 10 pm,https://api.change.org/p/ministry-of-environment-forests-climate-change-ban-bursting-firecrackers-after-10-pm,Global,Landscapes and forests,Clean energy,Sustainability,
807,21604,Learn More,https://api.change.org/p/learn-more,Global,Health and Safety,Human Rights,Education,
808,9654740,Charlie Baker: Governor Baker - Stop the Otis State Forest Pipeline!,https://api.change.org/p/charlie-baker-governor-baker-stop-the-otis-state-forest-pipeline,National,Landscapes and forests,Health and Safety,Clean energy,
809,8873318,WeThePeople: Elect Hillary Rodham Clinton,https://api.change.org/p/wethepeople-elect-hillary-rodham-clinton,National,Political,US Elections,,
810,8719670,United States Supreme Court: Deny Donald Drumpf the American Presidency,https://api.change.org/p/united-states-supreme-court-deny-donald-drumpf-the-american-presidency,National,Political,US Elections,,
811,7038101,The people of Florida: Criminal charges against Goveneror Rick Scott of Florida,https://api.change.org/p/the-people-of-florida-criminal-charges-against-goveneror-rick-scott-of-florida,National,Human Rights,Political,,
812,6994730,"Ministry of Environment, Forest and Climate Change: No Water and No Oxygen for Next Generation",https://api.change.org/p/ministry-of-environment-forest-and-climate-change-no-water-and-no-oxygen-for-next-generation,Global,Pollution,,,
813,324671,Womens History Mth: Act,https://api.change.org/p/womens-history-mth-act,Education,Human Rights,Women,,
814,8352089,California State Senate: Implementation of an ALL ELECTRONIC TOLLING SYSTEM on the 7 S.F. Bay Area Toll Bridges ASAP,https://api.change.org/p/california-state-senate-implementation-of-an-all-electronic-tolling-system-on-the-7-s-f-bay-area-toll-bridges-asap,National,Transportation,Political,,
815,6883643,70 Washington Condominium: 70 Washington: Switch to Clean Power,https://api.change.org/p/70-washington-condominium-70-washington-switch-to-clean-power,National,Clean energy,,,
816,7969238,Tell Lee County to VOTE NO on LeeTrans 2016 10-Year Plan.,https://api.change.org/p/tell-lee-county-to-vote-no-on-leetrans-2016-10-year-plan,National,Transportation,Human Rights,,
817,9992915,Every Republican and US Citizen for Change: Increase Secret Service Funding By 150% for Donald J. Trump,https://api.change.org/p/every-republican-and-us-citizen-for-change-increase-secret-service-funding-by-150-for-donald-j-trump,National,Political,,,
818,8774465,Rick Perry: Tell Rick Perry to Stop Construction of the DAPL,https://api.change.org/p/rick-perry-tell-rick-perry-to-stop-construction-of-the-dapl,Clean energy,,,,
819,7891199,"Support Residents of Port Blair, Andaman & Nicobar islands, in their demand for a City Owned Broad Band Network.",https://api.change.org/p/support-residents-of-port-blair-andaman-nicobar-islands-in-their-demand-for-a-city-owned-broad-band-network,Global,Human Rights,Sustainability,,
820,9047432,Fran Pavley: Urge California to adopt a carbon tax system,https://api.change.org/p/fran-pavley-urge-california-to-adopt-a-carbon-tax-system,National,Clean energy,Taxes,,
821,7405430,WTFrack?! Transparency Please! We want a Master Leasing Plan for La Plata Co.,https://api.change.org/p/wtfrack-transparency-please-we-want-a-master-leasing-plan-for-la-plata-co,National,Clean energy,Water,,
822,6828614,Sylvester Turner : Stop Houston Flooding,https://api.change.org/p/sylvester-turner-stop-houston-flooding,National,Water Crisis,,,
823,7087358,Barack Obama: Let the U.S. lead the world by limiting it's Nuclear stockpile to 10 active warheads.,https://api.change.org/p/barack-obama-let-the-u-s-lead-the-world-by-limiting-it-s-nuclear-stockpile-to-10-active-warheads,National,Political,Nuke,,
824,6359327,"Justin Trudeau: Protection of The Unist'ot'en lands, air, and water.",https://api.change.org/p/justin-trudeau-protection-of-the-unist-ot-en-lands-air-and-water,Global,Clean energy,Pollution,,
825,8308013,Amending the Presidential Age Requirement,https://api.change.org/p/amending-the-presidential-age-requirement,National,Political,,,
826,8870153,California's Tax Board: Extend the Gas Guzzler Tax to all  light trucks in CA,https://api.change.org/p/california-s-tax-board-extend-the-gas-guzzler-tax-to-all-light-trucks-in-ca,National,Clean energy,Taxes,,
827,7370207,"End Legal Corruption, Before Corruption Destroys the Planet.",https://api.change.org/p/end-legal-corruption-before-corruption-destroys-the-planet,National,Political,US Elections,,
828,6108242,Municipality of Sta Rosa: Implement Lanes for Cyclists and Runners,https://api.change.org/p/municipality-of-sta-rosa-implement-lanes-for-cyclists-and-runners,Global,Transportation,Clean energy,,
829,25728,Womens History Mth Act,https://api.change.org/p/womens-history-mth-act-2,Global,Human Rights,,,
830,7070015,ARAI: ARAI: Realistic emission and fuel efficiency tests for automobiles,https://api.change.org/p/arai-arai-realistic-emission-and-fuel-efficiency-tests-for-automobiles-db488955-70f6-4bbf-9dfc-8e7964565234,Global,Clean energy,Transportation,,
831,6760091,People of India and The Government of India: Green India,https://api.change.org/p/people-of-india-and-the-government-of-india-green-india,Global,Landscapes and forests,,,
832,3027136,"Development actors, Civil Society, NGOs, Politicals: To sign the Manifesto for quality housing in Sahelian Africa",https://api.change.org/p/development-actors-civil-society-ngos-politicals-to-sign-the-manifesto-for-quality-housing-in-sahelian-africa,Urban Planning,Human Rights,,,
833,9768737,Petition: Protect President Obama’s Progress!,https://api.change.org/p/petition-protect-president-obama-s-progress,National,Political,US Elections,,
834,8882294,"Everyone expecting to receive a gift this holiday season: This holiday season, be a do-gooder",https://api.change.org/p/everyone-expecting-to-receive-a-gift-this-holiday-season-this-holiday-season-be-a-do-gooder,Global,Human Rights,,,
835,8870231,Barack Obama: Change National Anthem,https://api.change.org/p/barack-obama-change-national-anthem,National,Political,US Elections,,
836,7009115,Spreading Awareness about Lead Poisoning in India,https://api.change.org/p/spreading-awareness-about-lead-poisoning-in-india,Global,Health and Safety,,,
837,6933116,The governments of the world: We call for the immediate worldwide cessation of the production of Animal Products,https://api.change.org/p/the-governments-of-the-world-we-call-for-the-immediate-worldwide-cessation-of-the-production-of-animal-products,Global,Animal Rights,,,
