no,petition_id,title,url,Category1,Category2,Category3,Category4,Category5
485,22236,free falsely jailed,https://api.change.org/p/free-falsely-jailed,National,Human Rights,,,
486,9836453,Congressman Lee Zeldin: Tell Lee Zeldin We Are His Boss,https://api.change.org/p/congressman-lee-zeldin-tell-lee-zeldin-we-are-his-boss,National,Political,,,
487,6790652,Rhodes College Board of Trustees: Support SASV Demands,https://api.change.org/p/rhodes-college-board-of-trustees-support-sasv-demands,Global,Harassement,Human Rights,,
488,9340718,Greater Chennai Corporation: TamilNadu government should implement Total Plastic Ban like Karnataka. Say NO to plastic!,https://api.change.org/p/greater-chennai-corporation-tamilnadu-government-should-implement-total-plastic-ban-like-karnataka-say-no-to-plastic,Global,Waste,Plastic,,
489,6365546,Ted Deutch: Save the BEES,https://api.change.org/p/ted-deutch-save-the-bees,National,Animal Rights,,,
490,6968564,Bernie Sanders: Save the Cows. Save the World. Ask Bernie to Support Plant Based Diets as a Solution.,https://api.change.org/p/bernie-sanders-save-the-cows-save-the-world-ask-bernie-to-support-plant-based-diets-as-a-solution,Vegan Diet,Political,National,,
491,6638996,"Bernie Sanders: By Earth Day, Climate Change Discussion Should Dominate the Democratic Primary",https://api.change.org/p/bernie-sanders-by-earth-day-climate-change-discussion-should-dominate-the-democratic-primary,National,Political,US Elections,,
492,6976502,socialist: A safeguard for environment (Ban plastic bag use by online retailers),https://api.change.org/p/socialist-a-safeguard-for-environment-ban-plastic-bag-use-by-online-retailers,Global,Landscapes and forests,Plastic,,
493,4268488,Eleanor McMahon MPP Burlington Ontario Canada: BAN single-use plastic water bottles in Burlington!,https://api.change.org/p/eleanor-mcmahon-mpp-burlington-ontario-canada-ban-single-use-plastic-water-bottles-in-burlington,Global,Plastic,,,
494,6960662,Rachel notley: Fire Blake Siefken from EPN for his Fort MacFire Comments,https://api.change.org/p/rachel-notley-fire-blake-siefken-from-epn-for-his-fort-macfire-comments,Global,Fire,,,
495,8643212,Governor Tomblin : NO DRILLING UNDER THE OHIO RIVER,https://api.change.org/p/governor-tomblin-no-drilling-under-the-ohio-river,National,Water,Clean energy,,
496,9958643,Dr. Denise Trauth: TXST strutters must decline invitation for inauguration performance,https://api.change.org/p/dr-denise-trauth-txst-strutters-must-decline-invitation-for-inauguration-performance,Education,National,Political,,
497,8112773,Endorse Queer Declaration calling for inclusion in the implementation of the New Urban Agenda of UN Habitat 3,https://api.change.org/p/endorse-queer-declaration-calling-for-inclusion-in-the-implementation-of-the-new-urban-agenda-of-un-habitat-3,Global,Human Rights,,,
498,8888078,Canisius Faculty Solidarity Letter: Racial Equity and Inclusion at Canisius College,https://api.change.org/p/canisius-faculty-solidarity-letter-racial-equity-and-inclusion-at-canisius-college,Education,Human Rights,,,
499,9904058,United States Congress: Congress:  Protect the Investment Tax Credit for Wind and Solar,https://api.change.org/p/united-states-congress-congress-protect-the-investment-tax-credit-for-wind-and-solar,National,Political,Clean energy,,
500,8859812,Let's Re-NU: Northeastern University Sustainability Action Plan,https://api.change.org/p/let-s-re-nu-northeastern-university-sustainability-action-plan,National,Recycle,Sustainability,,
501,8724536,Donald Trump: Trump: Please Keep the U.S. signed on to the Paris Agreement for the Sake of our Planet,https://api.change.org/p/donald-trump-trump-please-keep-the-u-s-signed-on-to-the-paris-agreement-for-the-sake-of-our-planet-7cdb9737-2216-4077-925e-0b3e07d0c736,National,Political,Paris Agreement,,
502,8798396,Donald Trump: Petition President-Elect Donald Trump to Acknowledge Climate Change,https://api.change.org/p/donald-trump-petition-president-elect-donald-trump-to-acknowledge-climate-change,National,Political,US Elections,,
503,7186499,Start highlighting the positive impact of meat & dairy-free diets to the public,https://api.change.org/p/start-highlighting-the-positive-impact-of-meat-dairy-free-diets-to-the-public,Vegan Diet,Global,Education,Heatlh and Safety,
504,9688421,"Starbucks, please make it CLEARER that you offer a $.10 discount for reusable cups.",https://api.change.org/p/starbucks-please-make-it-clearer-that-you-offer-a-10-discount-for-reusable-cups,Recycle,Waste,Business Greed,,
505,6426143,US Senator Sheldon Whitehouse: Retract your Superdelegate Commitment to Clinton in the Democratic Primaries,https://api.change.org/p/us-senator-sheldon-whitehouse-retract-your-superdelegate-commitment-to-clinton-in-the-democratic-primaries,National,Political,US Elections,,
506,6394103,California Fish and Game Commission: Support Additional Protections and Increased Opportunity on Coastal Streams in California,https://api.change.org/p/california-fish-and-game-commission-support-additional-protections-and-increased-opportunity-on-coastal-streams-in-california,National,Wildlife,Animal Rights,,
507,5801830,"Bernie Sanders, Debbie Wasserman Schultz, Andrew Cuomo, Hillary Clinton: The time is now. Lets get Hillary Clinton to debate Bernie Sanders in Brooklyn!",https://api.change.org/p/bernie-sanders-debbie-wasserman-schultz-andrew-cuomo-hillary-clinton-the-time-is-now-lets-get-hillary-clinton-to-debate-bernie-sanders-in-brooklyn,National,Political,US Elections,,
508,9081263,Fjallraven : Make Fjallraven Polar Raise Awareness about Climate Change in the Arctic,https://api.change.org/p/fjallraven-make-fjallraven-polar-raise-awareness-about-climate-change-in-the-arctic,Arctic,Education,,,
509,7557878,Hon Lily D'Ambrosio: BEACH BLIGHT Current Redevelopment Proposal for South Melbourne Life Saving Club,https://api.change.org/p/hon-lily-d-ambrosio-beach-blight-current-redevelopment-proposal-for-south-melbourne-life-saving-club,Global,Wildlife,,,
510,9724391,"CA Governor Jerry Brown and Members of CA Legislature: California, Rescue Federal Environmental Data & Research Teams",https://api.change.org/p/ca-governor-jerry-brown-and-members-of-ca-legislature-california-rescue-federal-environmental-data-research-teams,National,Education,,,
511,8541566,Indigenous Iowa: Dakota access pipeline day of action,https://api.change.org/p/indigenous-iowa-dakota-access-pipeline-day-of-action,Clean energy,Human Rights,,,
512,6821651,Petition: Make Chautauqua Park + Flatirons Accessible By Bus,https://api.change.org/p/petition-make-chautauqua-park-flatirons-accessible-by-bus,National,Landscapes and forests,Human Rights,,
513,9098861,Accademia Galleria: Let's Spray Acid on Michelangelo's David to Combat Climate Change,https://api.change.org/p/accademia-galleria-let-s-spray-acid-on-michelangelo-s-david-to-combat-climate-change,Global,Political,Art,,
514,8500850,"Dr. Jane Philpott: It is time to make ""Universal Medicare"" Universal: Calling for a National Pharmacare Strategy",https://api.change.org/p/dr-jane-philpott-it-is-time-to-make-universal-medicare-universal-calling-for-a-national-pharmacare-strategy,Global,Health and Safety,,,
515,7859522,City of Allen: Change the City of Allen Ordinance to Allow Solar Panels,https://api.change.org/p/city-of-allen-change-the-city-of-allen-ordinance-to-allow-solar-panels,National,Clean energy,Sustainability,,
516,7668278,Premier Andrews: Victorians say no to dirty coal projects,https://api.change.org/p/premier-andrews-victorians-say-no-to-dirty-coal-projects-5,Global,Clean energy,,,
517,5666354,The Government: Save our homes from the ravages of the sea.,https://api.change.org/p/the-government-save-our-homes-from-the-ravages-of-the-sea,Global,Human Rights,,,
518,8278994,Mayor Kevin Falconer: Approve Garnet Avenue Farmers Market - beautifulPB,https://api.change.org/p/mayor-kevin-falconer-approve-garnet-avenue-farmers-market-beautifulpb,National,Clean energy,,,
519,7183604,Australian Government to answer on failure to act on Climate Change,https://api.change.org/p/australian-government-to-answer-on-failure-to-act-on-climate-change,Global,Political,Wildlife,,
520,8321510,BBMP: Save Bengaluru's Green Cover,https://api.change.org/p/bbmp-save-bengaluru-s-green-cover,Global,Landscapes and forests,,,
521,7228394,"karen levenstein : Bring Sustainable, Vegan lunch options to Public Schools",https://api.change.org/p/karen-levenstein-bring-sustainable-vegan-lunch-options-to-public-schools,Vegan Diet,Education,National,,
522,8513888,The Chancellor: The government pays lip service to climate change,https://api.change.org/p/the-chancellor-the-government-pays-lip-service-to-climate-change,Global,Education,,,
523,6309785,The public : NUIG shops to use compostable cups; 1 million disposables end up in landfill per minute,https://api.change.org/p/the-public-nuig-shops-to-use-compostable-cups-1-million-disposables-end-up-in-landfill-per-minute,Global,Plastic,Recycle,Sustainability,
524,26105,Congress must insist on a responsible energy policy,https://api.change.org/p/congress-must-insist-on-a-responsible-energy-policy,National,Political,Clean energy,,
525,5663630,SPEA Dean John D. Graham: Petition for Transparency and Review of Private Funds to Indiana University's SPEA,https://api.change.org/p/spea-dean-john-d-graham-petition-for-transparency-and-review-of-private-funds-to-indiana-university-s-spea,National,Education,,,
526,5653614,URGENT! AZ Legislators Want to Take Away Our Local Control - NO on HB2130 & HB2131,https://api.change.org/p/urgent-az-legislators-want-to-take-away-our-local-control-no-on-hb2130-hb2131,National,Political,,,
527,8168396,STOP Importing Dogs with Heartworm Disease Into Atlantic Canada!!,https://api.change.org/p/stop-importing-dogs-with-heartworm-disease-into-atlantic-canada,Global,Health and Safety,,,
528,6877064,Facilities Management Department: Help Drive the University of Minnesota-TC towards Campus-Wide Organic Collection by 2020,https://api.change.org/p/facilities-management-department-help-drive-the-university-of-minnesota-tc-towards-campus-wide-organic-collection-by-2020,National,Education,,,
529,5750506,Prime Minister of Australia and the President of the United States: Stop deforestation and plant 1 trillion new trees globally by the year 2050.,https://api.change.org/p/prime-minister-of-australia-and-the-president-of-the-united-states-stop-deforestation-and-plant-1-trillion-new-trees-globally-by-the-year-2050,Global,Landscapes and forests,,,
530,9069653,Call on @JustinTrudeau to STOP the Kinder Morgan Pipeline,https://api.change.org/p/call-on-justintrudeau-to-stop-the-kinder-morgan-pipeline,Global,Political,Clean energy,,
531,7515707,Mark Leno: Provide Funding for The Healthy Soils Initiative,https://api.change.org/p/mark-leno-provide-funding-for-the-healthy-soils-initiative,National,Political,Health and Safety,Sustainability,
532,6304580,Malcom turnbull: Get australia green,https://api.change.org/p/malcom-turnbull-get-australia-green,Global,Clean energy,,,
533,23622,STOP global warming,https://api.change.org/p/stop-global-warming,National,,,,
534,8083184,PEOPLE:  WAKE UP!,https://api.change.org/p/people-wake-up,Global,,,,
535,2779131,UK Government: Introduce lighter evenings in the UK by putting the clocks forward an hour throughout the year so we are awake when the sun is out.,https://api.change.org/p/uk-government-introduce-lighter-evenings-in-the-uk-by-putting-the-clocks-forward-an-hour-throughout-the-year-so-we-are-awake-when-the-sun-is-out,Global,Education,,,
536,7297598,save environment for future generation - stop dilution of environmental laws by MoEF&CC,https://api.change.org/p/save-environment-for-future-generation-stop-dilution-of-environmental-laws-by-moef-cc,National,Pollution,,,
537,6194354,Dr. : Zero Tolerance for Racial Harassment and the N-word in our School System,https://api.change.org/p/dr-zero-tolerance-for-racial-harassment-and-the-n-word-in-our-school-system,Global,Human Rights,,,
538,9835649,Friends & Neighbors Advocating Better Green Living: Stop The Sun Tax In Evans NY,https://api.change.org/p/friends-neighbors-advocating-better-green-living-stop-the-sun-tax-in-evans-ny,National,Clean energy,,,
539,27060,Black History Month,https://api.change.org/p/black-history-month,Human Rights,National,,,
540,2344431,Monsieur le President de la Republique: Pour une transition écologique urgente donnant le droit à un avenir décent pour tous,https://api.change.org/p/monsieur-le-president-de-la-republique-pour-une-transition-%C3%A9cologique-urgente-donnant-le-droit-%C3%A0-un-avenir-d%C3%A9cent-pour-tous,Global,Clean energy,,,
541,8874713,Environmental Protection Agency: Go Vegan Today to Protest Myron Bell as EPA Leader,https://api.change.org/p/environmental-protection-agency-go-vegan-today-to-protest-myron-bell-as-epa-leader,Vegan Diet,National,Political,,
542,7095500,Bob Gibbs: End the unauthorized Geoengineering Program,https://api.change.org/p/bob-gibbs-end-the-unauthorized-geoengineering-program,National,Pollution,,,
543,9671684,Bernie Sanders: We would like to help reverse climate change by using inexpensive ideas.,https://api.change.org/p/bernie-sanders-we-would-like-to-help-reverse-climate-change-by-using-inexpensive-ideas,National,Political,US Elections,,
544,10031378,Oakland Mayor Libby Schaaf: Banning single-use Plastic Water Bottles in Oakland,https://api.change.org/p/oakland-mayor-libby-schaaf-banning-single-use-plastic-water-bottles-in-oakland,National,Plastic,Recycle,Ocean,
545,6312857,Trader Joe's: Stop Creating SO MUCH WASTE,https://api.change.org/p/trader-joe-s-stop-creating-so-much-waste,National,Plastic,Waste,Sustainability,
546,8980625,Hillary Clinton: Demand Recount of Election,https://api.change.org/p/hillary-clinton-demand-recount-of-election,National,Political,US Elections,,
547,9018320,TD Bank: Be a True Environmental Leader and Pull Funding from the DAPL,https://api.change.org/p/td-bank-be-a-true-environmental-leader-and-pull-funding-from-the-dapl,Clean energy,Business Greed,,,
548,3642975,"THE DOGCATCHER PLEDGE:
Sign this petition and force the Republican Party to deal with climate change.",https://api.change.org/p/the-dogcatcher-pledge-sign-this-petition-and-force-the-republican-party-to-deal-with-climate-change,National,Political,,,
549,21142,Inspire / Earth Day   :),https://api.change.org/p/inspire-earth-day,Global,,,,
550,7984421,Howard Schultz: Starbucks: Stop making waste!,https://api.change.org/p/howard-schultz-starbucks-stop-making-waste,Business greed,Waste,,,
551,6754631,National : Say NO to styrofoam usage for in-house eating,https://api.change.org/p/national-say-no-to-styrofoam-usage-for-in-house-eating,National,Waste,Plastic,Recycle,
552,7967579,Minister of Forest: Forest Ecosystem killed for Infrasturcture,https://api.change.org/p/minister-of-forest-forest-ecosystem-killed-for-infrasturcture,Global,Landscapes and forests,wildlife,Animal Rights,
553,26364,"Copenhagen, Native American + Indigenous",https://api.change.org/p/copenhagen-native-american-indigenous,Human Rights,Global,,,
554,7152380,The president of Zambia : Stop the South African farmers from take over Zambian agriculture sector,https://api.change.org/p/the-president-of-zambia-stop-the-south-african-farmers-from-take-over-zambian-agriculture-sector,Global,Landscapes and forests,,,
555,8749949,Donald Trump: Tell Donald Trump to Support Climate Change Efforts and the Paris  Agreement,https://api.change.org/p/donald-trump-tell-donald-trump-to-support-climate-change-efforts-and-the-paris-agreement,National,Political,Paris Agreement,,
556,6484358,"ACCADEMIA DELLA CRUSCA: Sostantivo bestia e aggettivo bestiale, riserviamoli esclusivamente  alla specie umana.",https://api.change.org/p/accademia-della-crusca-sostantivo-bestia-e-aggettivo-bestiale-riserviamoli-esclusivamente-alla-specie-umana,Global,Human Rights,,,
557,9689939,Alameda Municipal Power IT'S TIME TO GO SOLAR NOW,https://api.change.org/p/alameda-municipal-power-it-s-time-to-go-solar-now,National,Clean energy,,,
558,7691891,A petition to have solar panels installed in Queensland public housing to reduce the cost of electricity and the carbon footprint of public housing.,https://api.change.org/p/a-petition-to-have-solar-panels-installed-in-queensland-public-housing-to-reduce-the-cost-of-electricity-and-the-carbon-footprint-of-public-housing,Global,Clean energy,,,
559,6576932,TTC Commission : service cuts not the answer to low ridership,https://api.change.org/p/ttc-commission-service-cuts-not-the-answer-to-low-ridership,Global,Human Rights,,,
560,8053229,"The Hon. Lily D'Ambrosio Minister for Energy, Environment and Climate Change : Please take urgent action to restore the Viewbank Grain Silos!",https://api.change.org/p/the-hon-lily-d-ambrosio-minister-for-energy-environment-and-climate-change-please-take-urgent-action-to-restore-the-viewbank-grain-silos,National,,,,
561,8966843,Neil deGrasse Tyson: Neil deGrasse Tyson should meet with President-elect Trump to talk about climate change.,https://api.change.org/p/neil-degrasse-tyson-neil-degrasse-tyson-should-meet-with-president-elect-trump-to-talk-about-climate-change,National,Political,US Elections,,
562,6654698,Robert.Altenkirch@uah.edu: Honoring Jeff Sessions: A Challenge to UAH Values,https://api.change.org/p/robert-altenkirch-uah-edu-honoring-jeff-sessions-a-challenge-to-uah-values,National,Human Rights,Education,,
563,7588082,"GOP, Reince Priebus, and Donald Trump: Remove the Elephant from Republican Party Logos",https://api.change.org/p/gop-reince-priebus-and-donald-trump-remove-the-elephant-from-republican-party-logos,National,Political,Animal Rights,,
564,6262733,"World Trade Organization: Help Grow India's Solar Infrastructure - WTO, US back off!!",https://api.change.org/p/world-trade-organization-help-grow-india-s-solar-infrastructure-wto-us-back-off,Global,Clean energy,,,
565,8743895,Animal Agriculture Alliance: Small Changes for a Big Movement,https://api.change.org/p/animal-agriculture-alliance-small-changes-for-a-big-movement,National,Political,,,
566,8837702,Barack Obama: Expedite Legal Gender Changes Before 1/20,https://api.change.org/p/barack-obama-expedite-legal-gender-changes-before-1-20,National,Political,Human Rights,,
567,7366301,President Rodrigo Duterte: The Eco-challenge for Change,https://api.change.org/p/president-rodrigo-duterte-the-eco-challenge-for-change,Global,Political,Business Greed,,
568,8951903,San Diego County Board of Supervisors: San Diegans Stand Up For Progressive Vision,https://api.change.org/p/san-diego-county-board-of-supervisors-san-diegans-stand-up-for-progressive-vision,National,Political,US Elections,,
569,9723113,Nicolle Littrell: Belfast Resolve!  Please sign to support adoption of a city-wide Resolution,https://api.change.org/p/nicolle-littrell-belfast-resolve-please-sign-to-support-adoption-of-a-city-wide-resolution,National,Political,US Elections,,
570,7442525,"luke.donnellan@parliament.vic.gov.au: VicRoads: save $24M, listen to the people, don't trash the bush.",https://api.change.org/p/luke-donnellan-parliament-vic-gov-au-vicroads-save-24m-listen-to-the-people-don-t-trash-the-bush,Global,Landscapes and forests,,,
571,9784754,Governor Andrew Cuomo: Support a Carbon Tax in New York State,https://api.change.org/p/governor-andrew-cuomo-support-a-carbon-tax-in-new-york-state,National,Clean energy,Taxes,,
572,7309913,Petition to Concord’s Energy Future Task Force Members,https://api.change.org/p/petition-to-concord-s-energy-future-task-force-members,National,Health and Safety,Water,Clean energy,
573,1954440,UN: Arbitrate Gaza Peace NOW,https://api.change.org/p/un-arbitrate-gaza-peace-now,Global,Human Rights,,,
574,8865506,"Andy Harris: Mr. Trump help safe the environment, do not leave the Paris Accord.",https://api.change.org/p/andy-harris-mr-trump-help-safe-the-environment-do-not-leave-the-paris-accord,National,Political,Paris Agreement,,
575,8585714,Kerry Rouck: Wipe your bum only with renewable bamboo tissue; save British Columbia's Selkirk Forest.,https://api.change.org/p/kerry-rouck-wipe-your-bum-only-with-renewable-bamboo-tissue-save-british-columbia-s-selkirk-forest,Global,Landscapes and forests,,,
576,6727157,Pepperdine: Fossil Fuel Divestment,https://api.change.org/p/pepperdine-fossil-fuel-divestment,National,Education,Clean energy,,
577,9043286,Donald Trump: Appoint Kelly Ayotte the Head of the EPA,https://api.change.org/p/donald-trump-appoint-kelly-ayotte-the-head-of-the-epa,National,Political,Clean energy,,
578,8804336,Donald Trump: Honor the Paris Climate Accord!,https://api.change.org/p/donald-trump-honor-the-paris-climate-accord,National,Political,Paris Agreement,,
579,8727974,House of Representatives : Impeach Trump,https://api.change.org/p/house-of-representatives-impeach-trump,National,Political,,,
580,7554104,Ministry of Environment Forest and Climate Change: BAN TYRE BURNING DURING ‘BANDH’: STOP POLLUTION,https://api.change.org/p/ministry-of-environment-forest-and-climate-change-ban-tyre-burning-during-bandh-stop-pollution,Global,Landscapes and forests,Pollution,,
581,9670943,The University of the South: Sewanee: Divest from Fossil Fuels!,https://api.change.org/p/the-university-of-the-south-sewanee-divest-from-fossil-fuels,Education,Clean energy,National,,
582,7687049,McDonogh Community: Enhance McDonogh School's History Curriculum,https://api.change.org/p/mcdonogh-community-enhance-mcdonogh-school-s-history-curriculum,National,Education,,,
583,70361,Urgent Act: for all,https://api.change.org/p/urgent-act-for-all,Human Rights,National,,,
584,6246986,Lou Rinaldi MPP Norhtumberland-Quinte: Expand the Greenbelt into Northumberland County,https://api.change.org/p/lou-rinaldi-mpp-norhtumberland-quinte-expand-the-greenbelt-into-northumberland-county,Global,Landscapes and forests,,,
585,8122157,"CDM Executive Board UNFCCC: Seeking action against questionable CDM project Okhla Waste to Energy Plant, Delhi, India",https://api.change.org/p/cdm-executive-board-unfccc-seeking-action-against-questionable-cdm-project-okhla-waste-to-energy-plant-delhi-india,Global,Waste,Clean energy,,
586,6653762,*For USF students and faculty only*: Bring Green Monday to the University of San Francisco,https://api.change.org/p/for-usf-students-and-faculty-only-bring-green-monday-to-the-university-of-san-francisco,National,Education,Sustainability,,
587,8889284,John Key: Ban Fossil-fuels and become a Renewable Power Nation,https://api.change.org/p/john-key-ban-fossil-fuels-and-become-a-renewable-power-nation,Global,Clean energy,Sustainability,,
588,8086430,"World Wildlife Fund: IT IS NEVER TOO LATE TO SAVE OUR HOME CALLED THE ""EARTH""",https://api.change.org/p/world-wildlife-fund-it-is-never-too-late-to-save-our-home-called-the-earth,Global,Landscapes and forests,Wildlife,,
589,6945182,Demand a Bailout for the 99%!,https://api.change.org/p/demand-a-bailout-for-the-99,National,Clean energy,US Elections,,
590,25640,We can tax gas,https://api.change.org/p/we-can-tax-gas,National,Clean energy,Taxes,,
591,6319055,Darebin Councillors: Darebin Council Divestment now!,https://api.change.org/p/darebin-councillors-darebin-council-divestment-now,Global,Clean energy,Pollution,,
592,9852353,Tim Cook: Save Solar’s Fate Under a Trump Administration by Igniting the Solar Revolution,https://api.change.org/p/tim-cook-save-solar-s-fate-under-a-trump-administration-by-igniting-the-solar-revolution,Global,Clean energy,,,
593,9744683,Mr. Prakash Javdekar: Ensure KV FRI Dehradun Does Not Close Down,https://api.change.org/p/mr-prakash-javdekar-ensure-kv-fri-dehradun-does-not-close-down,Global,Landscapes and forests,,,
594,8346698,"Administration at Fayette County High School : To End the Trend of Criminalization, and Amend the Wrongs at Fayette County High School",https://api.change.org/p/administration-at-fayette-county-high-school-to-end-the-trend-of-criminalization-and-amend-the-wrongs-at-fayette-county-high-school,National,Education,,,
595,8268038,"Canada's Boiling Point: Where has our water gone, Trudeau !?",https://api.change.org/p/canada-s-boiling-point-where-has-our-water-gone-trudeau,Global,Political,Water,,
596,9968765,Help reduce deforestation and save the earth,https://api.change.org/p/help-reduce-deforestation-and-save-the-earth,Global,Landscapes and forests,,,
597,6394901,James Duarte : Bring Bernie to the Bronx!,https://api.change.org/p/james-duarte-bring-bernie-to-the-bronx,National,Political,US Elections,,
598,9710384,Rep. John Katko: Hold Rep. John Katko Accountable,https://api.change.org/p/rep-john-katko-hold-rep-john-katko-accountable,National,Human Rights,,,
599,6139758,segun.eubanks@pgcps.org; carolyn.boston@pgcps.org;   sonya3.williams@pgcps.org;  curtis.valentine@pg: Keeping A Valuable Anchor In Our Community,https://api.change.org/p/segun-eubanks-pgcps-org-carolyn-boston-pgcps-org-sonya3-williams-pgcps-org-curtis-valentine-pg-keeping-a-valuable-anchor-in-our-community,National,Education,Human Rights,,
600,9719984,We Won't Work For Companies That Support Trump Administration's Values,https://api.change.org/p/we-won-t-work-for-companies-that-support-trump-administration-s-values,Business greed,National,Political,,
601,7180541,Federal Minister for the Environment: Inform and educate Australian and global youth to help save the Great Barrier Reef,https://api.change.org/p/federal-minister-for-the-environment-inform-and-educate-australian-and-global-youth-to-help-save-the-great-barrier-reef,Global,Wildlife,,,
602,7111178,Jay Inslee: Turning all plastic products for packaging material into 100% biodegradable hemp.,https://api.change.org/p/jay-inslee-turning-all-plastic-products-for-packaging-material-into-100-biodegradable-hemp,National,Recycle,Sustainability,Plastic,
